{
  "architecture": "x64",
  "artifact_digest": "sha256:aaaaaaaaaaaaaaaaaaaaaaaaaaaaaaaaaaaaaaaaaaaaaaaaaaaaaaaaaaaaaaaa",
  "bindings": [],
  "capability_id": "python",
  "entrypoints": [
    "python.exe"
  ],
  "file_manifest_digest": "sha256:bbbbbbbbbbbbbbbbbbbbbbbbbbbbbbbbbbbbbbbbbbbbbbbbbbbbbbbbbbbbbbbb",
  "health": "healthy",
  "install_backend_id": "portable_archive",
  "instance_id": "python/cpython/3.12.9150.1013/win-x64",
  "kind": "runtime",
  "lifecycle_status": "active",
  "platform": "windows",
  "runtime_family": "python",
  "runtime_id": "python",
  "schema_version": 1,
  "source": {
    "integrity": {
      "artifact_digest": "sha256:aaaaaaaaaaaaaaaaaaaaaaaaaaaaaaaaaaaaaaaaaaaaaaaaaaaaaaaaaaaaaaaa",
      "file_manifest_digest": "sha256:bbbbbbbbbbbbbbbbbbbbbbbbbbbbbbbbbbbbbbbbbbbbbbbbbbbbbbbbbbbbbbbb"
    },
    "kind": "generated_fixture",
    "locator": "cache/fixtures/python/3.12.9150.1013",
    "provenance": {
      "publisher": "airoot-test",
      "source_id": "fixture/cpython-v1"
    },
    "signature": null
  },
  "store_path": "store/python/cpython/3.12.9150.1013/win-x64",
  "version": "3.12.9150.1013"
}
